[
  {
    "schemaVersion": "1.0",
    "metadata": {
      "tenantSlug": "xtech",
      "code": "PILOT-01",
      "name": "Đề nghị mua sắm",
      "description": "Đề nghị mua sắm",
      "ownerRoleCode": "ROLE_PROCESS_ADMIN",
      "systemOfRecord": "XOFFICE",
      "ownerSystem": "XOFFICE",
      "wave": null,
      "aiPolicy": {
        "canDraft": true,
        "canValidate": true,
        "canExplain": true,
        "canPublish": false,
        "canApprove": false
      }
    },
    "nodes": [
      {
        "id": "START",
        "type": "start",
        "name": "Bắt đầu",
        "config": {},
        "position": {
          "x": 0,
          "y": 200
        }
      },
      {
        "id": "FORM",
        "type": "form",
        "name": "Nhập Đề nghị mua sắm",
        "config": {
          "formCode": "FORM-PURCHASE-PROPOSAL"
        },
        "position": {
          "x": 120,
          "y": 200
        }
      },
      {
        "id": "MGR",
        "type": "approval",
        "name": "Trưởng đơn vị duyệt",
        "config": {
          "assignment": {
            "type": "requesterManager"
          },
          "slaHours": 24
        },
        "position": {
          "x": 240,
          "y": 200
        }
      },
      {
        "id": "IT",
        "type": "humanTask",
        "name": "CNTT thẩm định",
        "config": {
          "assignment": {
            "type": "role",
            "roleCode": "ROLE_IT_MANAGER"
          },
          "slaHours": 24
        },
        "position": {
          "x": 480,
          "y": 200
        }
      },
      {
        "id": "FIN_CHECK",
        "type": "humanTask",
        "name": "Kế toán kiểm tra",
        "config": {
          "assignment": {
            "type": "role",
            "roleCode": "ROLE_PROCESS_ADMIN"
          },
          "slaHours": 24
        },
        "position": {
          "x": 720,
          "y": 200
        }
      },
      {
        "id": "CFO",
        "type": "approval",
        "name": "CFO phê duyệt",
        "config": {
          "assignment": {
            "type": "role",
            "roleCode": "ROLE_CFO"
          },
          "slaHours": 24
        },
        "position": {
          "x": 960,
          "y": 200
        }
      },
      {
        "id": "AMOUNT_GATE",
        "type": "condition",
        "name": "Kiểm tra hạn mức",
        "config": {
          "expression": {
            "operator": "gt",
            "operands": [
              {
                "var": "request.amount"
              },
              0
            ]
          }
        },
        "position": {
          "x": 1200,
          "y": 200
        }
      },
      {
        "id": "CEO",
        "type": "approval",
        "name": "TGĐ phê duyệt",
        "config": {
          "assignment": {
            "type": "role",
            "roleCode": "ROLE_CEO"
          },
          "slaHours": 24
        },
        "position": {
          "x": 1440,
          "y": 200
        }
      },
      {
        "id": "CREATE_MR",
        "type": "serviceCall",
        "name": "Tạo Material Request",
        "config": {
          "connectorCode": "finerp",
          "actionCode": "create_material_request",
          "retry": {
            "maxAttempts": 3
          },
          "mappings": [
            {
              "target": "itemDescription",
              "source": "request.title",
              "required": true
            },
            {
              "target": "amount",
              "source": "request.amount",
              "transform": "toNumber",
              "required": true
            },
            {
              "target": "purpose",
              "source": "request.business_justification"
            },
            {
              "target": "department",
              "source": "request.department"
            },
            {
              "target": "requesterEmail",
              "source": "requesterEmail",
              "required": true
            }
          ]
        },
        "position": {
          "x": 1680,
          "y": 200
        }
      },
      {
        "id": "END",
        "type": "end",
        "name": "Hoàn thành",
        "config": {},
        "position": {
          "x": 1920,
          "y": 200
        }
      }
    ],
    "edges": [
      {
        "id": "e1",
        "source": "START",
        "target": "FORM"
      },
      {
        "id": "e2",
        "source": "FORM",
        "target": "MGR"
      },
      {
        "id": "e3",
        "source": "MGR",
        "target": "IT"
      },
      {
        "id": "e4",
        "source": "IT",
        "target": "FIN_CHECK"
      },
      {
        "id": "e5",
        "source": "FIN_CHECK",
        "target": "CFO"
      },
      {
        "id": "e6",
        "source": "CFO",
        "target": "AMOUNT_GATE"
      },
      {
        "id": "e7",
        "source": "AMOUNT_GATE",
        "target": "CEO"
      },
      {
        "id": "e8",
        "source": "CEO",
        "target": "CREATE_MR"
      },
      {
        "id": "e9",
        "source": "CREATE_MR",
        "target": "END"
      }
    ],
    "variables": [],
    "forms": [],
    "presentation": {
      "viewport": {
        "x": 0,
        "y": 0,
        "zoom": 0.85
      }
    }
  },
  {
    "schemaVersion": "1.0",
    "metadata": {
      "tenantSlug": "xtech",
      "code": "PILOT-02",
      "name": "Đề nghị thanh toán",
      "description": "Đề nghị thanh toán",
      "ownerRoleCode": "ROLE_PROCESS_ADMIN",
      "systemOfRecord": "XOFFICE",
      "ownerSystem": "XOFFICE",
      "wave": null,
      "aiPolicy": {
        "canDraft": true,
        "canValidate": true,
        "canExplain": true,
        "canPublish": false,
        "canApprove": false
      }
    },
    "nodes": [
      {
        "id": "START",
        "type": "start",
        "name": "Bắt đầu",
        "config": {},
        "position": {
          "x": 0,
          "y": 200
        }
      },
      {
        "id": "FORM",
        "type": "form",
        "name": "Nhập Đề nghị thanh toán",
        "config": {
          "formCode": "FORM-PAYMENT-PROPOSAL"
        },
        "position": {
          "x": 120,
          "y": 200
        }
      },
      {
        "id": "MGR",
        "type": "approval",
        "name": "Trưởng đơn vị",
        "config": {
          "assignment": {
            "type": "requesterManager"
          },
          "slaHours": 24
        },
        "position": {
          "x": 240,
          "y": 200
        }
      },
      {
        "id": "ACCOUNTANT",
        "type": "humanTask",
        "name": "Kế toán kiểm tra",
        "config": {
          "assignment": {
            "type": "role",
            "roleCode": "ROLE_PROCESS_ADMIN"
          },
          "slaHours": 24
        },
        "position": {
          "x": 480,
          "y": 200
        }
      },
      {
        "id": "CFO",
        "type": "approval",
        "name": "CFO phê duyệt",
        "config": {
          "assignment": {
            "type": "role",
            "roleCode": "ROLE_CFO"
          },
          "slaHours": 24
        },
        "position": {
          "x": 720,
          "y": 200
        }
      },
      {
        "id": "CREATE_PR",
        "type": "serviceCall",
        "name": "Tạo Payment Request",
        "config": {
          "connectorCode": "xoffice",
          "actionCode": "submit_create_pr",
          "mappings": []
        },
        "position": {
          "x": 960,
          "y": 200
        }
      },
      {
        "id": "END",
        "type": "end",
        "name": "Hoàn thành",
        "config": {},
        "position": {
          "x": 1200,
          "y": 200
        }
      }
    ],
    "edges": [
      {
        "id": "e1",
        "source": "START",
        "target": "FORM"
      },
      {
        "id": "e2",
        "source": "FORM",
        "target": "MGR"
      },
      {
        "id": "e3",
        "source": "MGR",
        "target": "ACCOUNTANT"
      },
      {
        "id": "e4",
        "source": "ACCOUNTANT",
        "target": "CFO"
      },
      {
        "id": "e5",
        "source": "CFO",
        "target": "CREATE_PR"
      },
      {
        "id": "e6",
        "source": "CREATE_PR",
        "target": "END"
      }
    ],
    "variables": [],
    "forms": [],
    "presentation": {
      "viewport": {
        "x": 0,
        "y": 0,
        "zoom": 0.85
      }
    }
  },
  {
    "schemaVersion": "1.0",
    "metadata": {
      "tenantSlug": "xtech",
      "code": "PILOT-03",
      "name": "Đề nghị tạm ứng",
      "description": "Đề nghị tạm ứng",
      "ownerRoleCode": "ROLE_PROCESS_ADMIN",
      "systemOfRecord": "FRAPPE_HR",
      "ownerSystem": "FRAPPE_HR",
      "wave": null,
      "aiPolicy": {
        "canDraft": true,
        "canValidate": true,
        "canExplain": true,
        "canPublish": false,
        "canApprove": false
      }
    },
    "nodes": [
      {
        "id": "START",
        "type": "start",
        "name": "Bắt đầu tại Frappe HR",
        "config": {},
        "position": {
          "x": 0,
          "y": 200
        }
      },
      {
        "id": "FORM",
        "type": "form",
        "name": "Nhập Đề nghị tạm ứng",
        "config": {
          "formCode": "FORM-EMPLOYEE-ADVANCE"
        },
        "position": {
          "x": 120,
          "y": 200
        }
      },
      {
        "id": "MGR",
        "type": "approval",
        "name": "Quản lý duyệt",
        "config": {
          "assignment": {
            "type": "requesterManager"
          },
          "slaHours": 24
        },
        "position": {
          "x": 240,
          "y": 200
        }
      },
      {
        "id": "ACCOUNTANT",
        "type": "humanTask",
        "name": "Kế toán kiểm tra",
        "config": {
          "assignment": {
            "type": "role",
            "roleCode": "ROLE_PROCESS_ADMIN"
          },
          "slaHours": 24
        },
        "position": {